{"$schema":"https://json-schema.org/draft/2020-12/schema","$id":"CTR-EVT-001","title":"Domain Event Envelope","type":"object","additionalProperties":false,"required":["event_id","event_type","event_version","occurred_at","producer","tenant_context","subject","correlation_id","payload","metadata"],"properties":{"event_id":{"type":"string","minLength":1},"event_type":{"type":"string","pattern":"^[a-z0-9]+\\.[a-z0-9]+\\.[a-z0-9]+$"},"event_version":{"type":"integer","minimum":1},"occurred_at":{"type":"string","format":"date-time"},"producer":{"type":"object","additionalProperties":false,"required":["module_key","implementation_version"],"properties":{"module_key":{"type":"string","minLength":1},"implementation_version":{"type":"string","minLength":1}}},"tenant_context":{"$ref":"../../ctr-ten-001/schema.json"},"subject":{"type":"object","additionalProperties":false,"required":["type","id","version"],"properties":{"type":{"type":"string","minLength":1},"id":{"type":"string","minLength":1},"version":{"type":"integer","minimum":1}}},"correlation_id":{"type":"string","minLength":1},"causation_id":{"type":"string","minLength":1},"idempotency_key":{"type":"string","minLength":1},"payload":{"type":"object","maxProperties":0},"metadata":{"type":"object","additionalProperties":false,"required":["schema_ref"],"properties":{"schema_ref":{"type":"string","minLength":1}}}}}
