{"event_id":"00000000-0000-4000-8000-000000000101","event_type":"research.run.completed","event_version":1,"occurred_at":"2026-08-31T00:00:00.000Z","producer":{"module_key":"research-suggestion","implementation_version":"1.0.0"},"tenant_context":{"workspace_id":"00000000-0000-4000-8000-000000000001","actor":{"kind":"system_actor","id":"research-worker"},"request_id":"00000000-0000-4000-8000-000000000005","correlation_id":"00000000-0000-4000-8000-000000000006","locale":"th-TH","timezone":"Asia/Bangkok"},"subject":{"type":"research_run","id":"00000000-0000-4000-8000-000000000102","version":1},"correlation_id":"00000000-0000-4000-8000-000000000006","payload":{},"metadata":{"schema_ref":"CTR-EVT-001@1.0.0"}}
